Question Type,Answer Precision,Answer Recall,Answer F1,Answer Accuracy,Explanation Precision,Explanation Recall,Explanation F1,Explanation Accuracy,Count
three tables two joins,0.8462,0.2558,0.3929,0.5455,0.0000,0.0000,0.0000,0.0000,11
two tables single join multiple rows,0.7059,0.1690,0.2727,0.1000,0.0000,0.0000,0.0000,0.0000,10
two tables single join,0.2000,0.0500,0.0800,0.1000,0.0000,0.0000,0.0000,0.0000,10
single table single row,0.5000,0.4444,0.4706,0.4444,1.0000,0.8889,0.9412,0.4444,9
single table multiple rows,0.7241,0.4118,0.5250,0.4444,0.5833,0.1373,0.2222,0.2222,9
